project_id,source_type,published_at,title,url,raw_department_name,cause_bucket,evidence
2449,press_release,2026-01-26,令和8年度自治医科大学医学部入学試験(一般選抜) 第1次試験[学力試験]及第者を発表します,https://www.pref.saga.lg.jp/kiji003100765/index.html,医務課,no_contact_section_detected,令和8年度自治医科大学医学部入学試験(一般選抜) 第1次試験[学力試験]及第者を発表します / 最終更新日: / 2026年1月26日 / 令和8年度自治医科大学医学部入学試験(一般選抜) 第1次試験[学力試験] 及第者 / 及第者は次のとおりです。 / 受験番号 / 41002 / 41004
2245,press_release,2026-01-26,総勢100名に当たる!サガマイル大抽選会2026Winterを開催します!(2月1日から応募開始🎉),https://www.pref.saga.lg.jp/airport/kiji003114647/index.html,空港課,no_contact_section_detected,総勢100名に当たる!サガマイル大抽選会2026Winterを開催します!(2月1日から応募開始🎉) / 最終更新日: / 2026年1月26日 / 総勢100名に当たる!サガマイル大抽選会2026Winterを開催します!(2月1日から応募開始🎉) / チラシはこちら / サガマイル大抽選会2026Winter / (PDF:871.7キロバイト) / 日ごろより九州佐賀国際空港マイエアポートクラブ公式アプリをご利用いただきまして、ありがとうございます。
2066,proposal,2026-01-26,インフライズ(インフラ付加価値向上)業務委託に係るプロポーザルの結果をお知らせします,https://www.pref.saga.lg.jp/kiji003117847/index.html,県土企画課,result_or_answer_page_without_contact,インフライズ(インフラ付加価値向上)業務委託に係るプロポーザルの結果をお知らせします
2463,press_release,2026-01-23,佐賀県調理師試験を実施する指定試験機関の主たる事務所の所在地等の変更,https://www.pref.saga.lg.jp/kiji003117783/index.html,健康福祉政策課,no_contact_section_detected,佐賀県調理師試験を実施する指定試験機関の主たる事務所の所在地等の変更 / 最終更新日: / 2026年1月23日 / 調理師法(昭和33年法律第147号)第3条の2第2項に規定する調理師試験の実施に関する事務を行わせている公益社団法人調理技術技能センターから調理師法施行令(昭和33年政令第303号)第2条の2第2項の規定による変更の届出があったので、同条第3項の規定に基づき次のとおり公示する。 / 令和8年1月21日 / 佐賀県知事 山口 祥義 / 1 変更後の主たる事務所の
2415,press_release,2026-01-21,2025年度ユニットケア研修のお知らせ,https://www.pref.saga.lg.jp/kiji00396243/index.html,一般社団法人 全国個室ユニット型施設推進協議会 事務局 ユニットケア研修担当,source_has_department_only,お問い合わせ先 一般社団法人 全国個室ユニット型施設推進協議会 事務局 ユニットケア研修担当 〒222-0033 神奈川県横浜市港北区新横浜3-20-8 ベネックスS-3・4階 TEL:045-577-4212 FAX:045-577-4213 Mail:suishinkyo-unitcare@suishinkyo.net URL:https://suishinkyo.net
2298,press_release,2026-01-21,令和7年度CSO・企業提案型協働創出事業を実施しました,https://www.pref.saga.lg.jp/kiji003117666/index.html,佐賀県 県民環境部 県民協働課 協働社会推進担当,needs_reingest_inline_person,いましたら下記へ遠慮なく御連絡ください。 佐賀県 県民環境部 県民協働課 協働社会推進担当 TEL:0952-25-7374 E-mail:kenminkyoudou@pref.saga.lg.jp (2)市町の協働担当部署
2785,press_release,2026-01-20,佐賀商業定時制で「星空学習会」を開催します,https://www.pref.saga.lg.jp/kyouiku/kiji003117722/index.html,教育総務課,no_contact_section_detected,佐賀商業定時制で「星空学習会」を開催します / 最終更新日: / 2026年1月20日 / 令和8年(2026年)1月16日 / 佐賀県立佐賀商業高等学校定時制課程 / 担 当:宮原 / 電話:0952-30-8571 / E-mail:
2026,proposal,2026-01-20,「佐賀県物流2024年問題対策支援補助金」の2次公募について,https://www.pref.saga.lg.jp/kiji003107571/index.html,物流2024 年問題対策支援補助金担当,source_has_department_only,7 申請窓口(申請書類の提出先及び問い合わせ先) 〒849-0921 佐賀市高木瀬西3丁目1番20号 公益社団法人佐賀県トラック協会 【電話】0952-20-5535 (平日9時から12時、13時から16時30分まで) 佐賀県トラック協会H P
2324,press_release,2026-01-19,認定特定非営利活動法人スチューデント・サポート・フェイスへ 人権研修の講師を派遣しました,https://www.pref.saga.lg.jp/kiji003117714/index.html,人権・同和対策課,no_contact_section_detected,認定特定非営利活動法人スチューデント・サポート・フェイスへ 人権研修の講師を派遣しました / 最終更新日: / 2026年1月19日 / 認定特定非営利活動法人スチューデント・サポート・フェイスの主催で開催された人権研修会へ講師を派遣しました。 / 【概要】 / 0 日 時:令和7年12月25日(木曜日) / 〇 場 所:佐賀市青少年センター / 〇 講 師:佐賀県教育委員会事務局 学校教育課 人権・同和教育指導員 江﨑美枝子氏
2075,proposal,2026-01-16,佐賀県遺産支援応援プロジェクトの寄附募集について,https://www.pref.saga.lg.jp/kiji003117260/index.html,佐賀県総務部税政課税務政策・ふるさと納税担当,needs_reingest_inline_person,その他、ふるさと納税や企業版ふるさと納税、寄附の申込方法等について、ご不明な点がございましたら、下記にお問合せください。 佐賀県 総務部 税政課 TEL:0952-25-7028 FAX:0952-25-7294(土日休日を除く9時0分~17時0分) Mail:sagakenkifu@pref.saga.lg.jp (5)参考資料
2071,proposal,2026-01-16,建設工事等入札参加資格 記載事項変更届の様式,https://www.pref.saga.lg.jp/kiji00325878/index.html,入札・契約担当,no_contact_section_detected,建設工事等入札参加資格 記載事項変更届の様式 / 最終更新日: / 2026年1月16日 / 記載事項変更届の提出は、持参のほか、郵送でも受け付けています。 / 県の建設業者施行能力等級表に記載されている商号、所在地、代表者氏名、電話番号等を変更した場合は、速やかに建設・技術課へ記載事項変更届をご提出ください。 / 届出の漏れにより指名や契約に影響を与えた場合は、「佐賀県建設工事等請負・委託契約に基づく指名停止等の措置要領」に基づき指名停止等の措置が行われる場合があります。(
180,proposal,2026-01-16,佐賀県農業改良資金未収金回収業務委託に係る企画提案競技(公募型プロポーザル方式)の中止について。,https://www.pref.saga.lg.jp/kiji003117698/index.html,生産者支援課,no_contact_section_detected,佐賀県農業改良資金未収金回収業務委託に係る企画提案競技(公募型プロポーザル方式)の中止について。 / 最終更新日: / 2026年1月16日 / 佐賀県農業改良資金未収金回収業務委託に係る企画提案競技(公募型プロポーザル方式)の中止について。 / 令和7年12月8日に公告した佐賀県農業改良資金未収金回収業務委託に係る企画提案競技(公募型プロポーザル方式)については、 / 公募期間に応募がなかったことから中止しましたのでお知らせします。 / 今後については、公募条件などの見直し
2072,proposal,2026-01-14,【受付を終了しました】<追加受付>令和8年度入札参加資格審査の申請受付について【県内・建設工事業者】,https://www.pref.saga.lg.jp/kiji00399009/index.html,佐賀県税事務所 納税課,needs_reingest_inline_person,申請書提出先(お問い合わせ先) 〒840-8570 佐賀市城内1丁目1番59 号 佐賀県県土整備部建設・技術課 入札・契約担当 ※郵送の場合は、封筒に「入札参加資格審査申請(県内建設工事)」と朱書きすること。 電話 : 0952-25-7102 メール: shimeinegai@pref.saga.lg.jp
2787,press_release,2026-01-13,令和7年度 中高合同「探究」発表会を開催します,https://www.pref.saga.lg.jp/kyouiku/kiji003117633/index.html,教育総務課,no_contact_section_detected,令和7年度 中高合同「探究」発表会を開催します / 最終更新日: / 2026年1月13日 / 令和8年(2026 年)1月13日 / 佐賀県立武雄青陵中学校・武雄高等学校 / 担 当:教頭 土橋 浩幸・藤生 京子 / 電 話:0954-33-3177・0954-22-3103 / E-mail:takeoseiryouchuugakkou@pref.saga.lg.jp
2073,proposal,2026-01-13,令和7年度第3回佐賀県建設工事入札審査会を開催します。,https://www.pref.saga.lg.jp/kiji003117335/index.html,建設・技術課 入札・契約担当,needs_reingest_inline_person,佐賀県 県土整備部 建設・技術課 入札・契約担当 電話 0952-25-7102(直通) FAX 0952-25-7317 E-mail
2019,proposal,2026-01-13,【子育てランド九州プロジェクト】「職場でのもやもや体験談」を募集します!,https://www.pref.saga.lg.jp/kiji003117637/index.html,子育てランド九州プロジェクト事務局,no_contact_section_detected,【子育てランド九州プロジェクト】「職場でのもやもや体験談」を募集します! / 最終更新日: / 2026年1月13日 / 「職場でのもやもや体験談」を募集します! / 体験談募集について / 九州地域戦略会議では、性別を理由にした役割分担意識や、アンコンシャス・バイアス(無意識の思い込み)の解消に取り組んでいます。その一環として、九州・山口県内で働いている方を対象として、「職場でのもやもや体験談」についてインターネット調査を行います。 / つきましては、九州・山口県内で働いて
2282,press_release,2026-01-09,「令和7年度 高付加価値旅行者をターゲットとした佐賀県陶磁器ブランディング動画制作業務」の委託先を決定しました,https://www.pref.saga.lg.jp/kiji003117770/index.html,観光課,no_contact_section_detected,「令和7年度 高付加価値旅行者をターゲットとした佐賀県陶磁器ブランディング動画制作業務」の委託先を決定しました / 最終更新日: / 2026年1月9日 / 「令和7年度 高付加価値旅行者をターゲットとした佐賀県陶磁器ブランディング動画制作業務」の委託先を決定しました / 「令和7年度 高付加価値旅行者をターゲットとした佐賀県陶磁器ブランディング動画制作業務」の委託契約を行うにあたり、企画コンペを実施したところ、下記の結果となりました。 / 記 / 1 契約案件名 / 令和7
2158,press_release,2026-01-09,第89回(令和7年度第3回)佐賀県情報公開・個人情報保護審査会,https://www.pref.saga.lg.jp/kiji003117624/index.html,総務部 法務私学課 情報公開・文書担当,source_has_department_only,問い合わせ先 担当課 総務部 法務私学課 情報公開・文書担当 電話 0952-25-7009 FAX 0952-25-7260 E-mail houmu-shigaku@pref.saga.lg.jp ---
2065,proposal,2026-01-09,ガンガゼバスターズ応援プロジェクトの寄附募集について,https://www.pref.saga.lg.jp/kiji003112744/index.html,佐賀県総務部税政課税務政策・ふるさと納税担当,needs_reingest_inline_person,その他、ふるさと納税や企業版ふるさと納税、寄附の申込方法等について、ご不明な点がございましたら、下記にお問合せください。 佐賀県 総務部 税政課 TEL:0952-25-7028 FAX:0952-25-7294 Mail:sagakenkifu@pref.saga.lg.jp
2033,proposal,2026-01-08,子どもたちにものづくりの魅力を伝えよう!プロジェクトの寄附募集について,https://www.pref.saga.lg.jp/kiji00388950/index.html,佐賀県 総務部 税政課,needs_reingest_inline_person,をご覧ください。 佐賀県 総務部 税政課 TEL:0952-25-7028 FAX:0952-25-7294 mail: furusatosagaken@pref.saga.lg.jp ---
2531,press_release,2026-01-06,佐賀さいこう企業表彰とは,https://www.pref.saga.lg.jp/kiji00384557/index.html,ものづくり産業課,no_contact_section_detected,佐賀さいこう企業表彰とは / 最終更新日: / 2026年1月6日 / 佐賀さいこう企業表彰とは / 目的 / 県内には国内はもとより、世界を舞台に活躍する素晴らしい企業がたくさんあります。 / これら県内企業の努力を県民に広く知ってもらうことによって、県内企業の認知度向上やイメージアップ、従業員のモチベーションアップや働くことを 誇りに思う気持ちを醸成するとともに、県民が佐賀県を誇りに思うことや県外に流出している高校生や大学生等の県内企業への就職につなげることを目的としてい
2529,press_release,2026-01-06,第6回~ 佐賀さいこう企業表彰 受賞企業,https://www.pref.saga.lg.jp/kiji00385396/index.html,ものづくり産業課,no_contact_section_detected,第6回~ 佐賀さいこう企業表彰 受賞企業 / 最終更新日: / 2026年1月6日 / 第6回~ 佐賀さいこう企業表彰 受賞企業 / 第6回~第7回佐賀さいこう企業表彰受賞企業を紹介します。 / 第6回 受賞企業 / ・ / 株式会社アイティーインペル
2498,press_release,2026-01-06,佐賀県保育士等キャリアアップ研修・子育て支援員研修・放課後児童支援員認定資格研修の修了証再発行について,https://www.pref.saga.lg.jp/kiji00396756/index.html,佐賀県こども未来課 保育幼稚園担当,needs_reingest_inline_person,申請に関するお問い合わせ先 佐賀県こども未来課 保育幼稚園担当 0952-25-7616 hoikuyouchien@pref.saga.lg.jp ---
2497,press_release,2026-01-06,施設型給付等に係る処遇改善等加算(区分3)に係る研修の実施主体の認定について,https://www.pref.saga.lg.jp/kiji00397867/index.html,こども未来課,no_contact_section_detected,施設型給付等に係る処遇改善等加算(区分3)に係る研修の実施主体の認定について / 最終更新日: / 2026年1月6日 / 幼稚園及び認定こども園における施設型給付等に係る処遇改善等加算(区分3)研修について、加算認定自治体は、幼稚園関係団体・認定こども園関係団体のうち適当と認める者を、研修実施主体として認定できることとなっています。 / 佐賀県では、以下の各団体を施設型給付等に係る処遇改善等加算(区分3)研修の実施主体として認定しておりますのでお知らせします。 / 佐賀県が
2790,press_release,2026-01-05,令和7年度「新春100人一首かるた会」を開催します,https://www.pref.saga.lg.jp/kyouiku/kiji003117559/index.html,教育総務課,no_contact_section_detected,令和7年度「新春100人一首かるた会」を開催します / 最終更新日: / 2026年1月5日 / 令和7年(2025年) 12月25日 / 佐賀県立佐賀西高等学校 / 担 当:野田、平野 / 電話:0952-24-4331 / E-mail:saganishikoukou@pref.saga.lg.jp
2299,press_release,2026-01-05,佐賀県と株式会社名村造船所は包括連携協定を締結しました。,https://www.pref.saga.lg.jp/kiji003117540/index.html,県民協働課,no_contact_section_detected,佐賀県と株式会社名村造船所は包括連携協定を締結しました。 / 最終更新日: / 2026年1月5日 / 佐賀県と株式会社名村造船所は、地域の一層の活性化および県民サービスの向上に資するため、令和7年12月18日(木曜日)に包括連携協定を締結しました。 / 協定の概要 / 1 協定締結の目的 / 佐賀県と株式会社名村造船所が相互に連携を図り、協働による取組を推進することにより、佐賀県らしい地域社会を創造していくこと / 2 連携事項
2237,press_release,2026-01-05,令和7年3月24日からパスポート(旅券)の交付までの日数と交付手数料が変わりました,https://www.pref.saga.lg.jp/kiji003111355/index.html,多文化共生さが推進課,no_contact_section_detected,令和7年3月24日からパスポート(旅券)の交付までの日数と交付手数料が変わりました / 最終更新日: / 2026年1月5日 / 令和7(2025)年3月24日からパスポート(旅券)の交付までの日数と交付手数料が変わりました / 令和7(2025)年3月24日受付分からパスポートの利便性向上や偽変造防止対策強化等の取り組みが行われ、受付から交付までの日数が9日間に変更となりました。 / 3月23日までは、旅券の更新申請(切替申請)がマイナポータルから電子申請(オンライン申請)
2049,proposal,2026-01-05,【質問回答】第80回全国お茶まつり佐賀大会広報デザイン作成業務に係る企画コンペの質問への回答を掲載します,https://www.pref.saga.lg.jp/kiji003117509/index.html,園芸農産課,result_or_answer_page_without_contact,【質問回答】第80回全国お茶まつり佐賀大会広報デザイン作成業務に係る企画コンペの質問への回答を掲載します
2020,proposal,2026-01-05,困難や不安を抱える女性の居場所づくりプロジェクトの寄附募集について,https://www.pref.saga.lg.jp/kiji003105811/index.html,佐賀県総務部税政課税務政策・ふるさと納税担当,needs_reingest_inline_person,その他、ふるさと納税や企業版ふるさと納税、寄附の申込方法等について、ご不明な点がございましたら、下記にお問合せください。 佐賀県 総務部 税政課 TEL:0952-25-7028 FAX:0952-25-7294(土日休日を除く9時0分~17時0分) Mail:sagakenkifu@pref.saga.lg.jp
1979,proposal,2026-01-05,さがすたいるプロジェクトの寄附募集について,https://www.pref.saga.lg.jp/kiji003106028/index.html,佐賀県総務部税政課税務政策・ふるさと納税担当,needs_reingest_inline_person,その他、ふるさと納税や企業版ふるさと納税、寄附の申込方法等について、ご不明な点がございましたら、下記にお問合せください。 佐賀県 総務部 税政課 TEL:0952-25-7028 FAX:0952-25-7294(土日休日を除く9時0分~17時0分) Mail:sagakenkifu@pref.saga.lg.jp
2194,press_release,2026-01-01,県税の猶予制度に関するお知らせ,https://www.pref.saga.lg.jp/kiji00373634/index.html,佐賀県税事務所,source_has_department_only,問い合わせ先 機関名称 電話番号 メールアドレス 所在地 管轄区域
1980,proposal,2025-12-26,「さがすたいるアウトドア体験事業」企画・運営等委託業務に係るプロポーザルの審査結果をお知らせします。,https://www.pref.saga.lg.jp/kiji003117575/index.html,県民協働課,result_or_answer_page_without_contact,「さがすたいるアウトドア体験事業」企画・運営等委託業務に係るプロポーザルの審査結果をお知らせします。
54,proposal,2025-12-26,佐賀県立鳥栖特別支援学校及び佐賀県立中原特別支援学校給食調理業務委託に係る総合評価一般競争入札の結果をお知らせします,https://www.pref.saga.lg.jp/kiji003117541/index.html,教育振興課,result_or_answer_page_without_contact,佐賀県立鳥栖特別支援学校及び佐賀県立中原特別支援学校給食調理業務委託に係る総合評価一般競争入札の結果をお知らせします
2614,press_release,2025-12-25,就農応援フェアinさがを開催します,https://www.pref.saga.lg.jp/kiji003117508/index.html,中央郵便局,source_has_department_only,問い合わせ先/佐賀県農業経営課 0952-25-7118 shunou-shien@pref.saga.lg.jp 就農応援フェアinさが ~がばいよかとこ!あなたの未来、佐賀の大地で育てよう~ 主催/佐賀県農業経営課
2466,press_release,2025-12-25,令和7年度(2025年度)麻薬小売業者間譲渡許可継続申請についてお知らせします,https://www.pref.saga.lg.jp/kiji003115684/index.html,佐賀県薬務課,no_contact_section_detected,令和7年度(2025年度)麻薬小売業者間譲渡許可継続申請についてお知らせします / 最終更新日: / 2025年12月25日 / 令和7年12月31日で有効期間が満了する麻薬小売業者間譲渡許可について、引き続き許可を受ける場合は、令和7年11月28日までに申請してください。 / 麻薬小売業者間譲渡許可の詳細は、 / こちらのページ / をご確認ください。 / 1.継続申請の方法について
1337,proposal,2025-12-24,福岡都市圏における佐賀県ブランドイメージ等調査・集計業務委託に係る企画競争の結果をお知らせします,https://www.pref.saga.lg.jp/kiji003117489/index.html,広報広聴課,result_or_answer_page_without_contact,福岡都市圏における佐賀県ブランドイメージ等調査・集計業務委託に係る企画競争の結果をお知らせします
2752,press_release,2025-12-23,建築基準法に規定する「指定道路図」の公開(唐津市地区),https://www.pref.saga.lg.jp/kiji00380855/index.html,唐津土木事務所建築課,source_has_department_only,お問い合わせ先 公開した指定道路図の詳細な情報については、所管する土木事務所の建築担当課窓口で確認ください。 唐津土木事務所建築課 〒847-0861 唐津市二タ子3-1-5 TEL0955-73-2865
2714,press_release,2025-12-23,盛土規制法に関する説明会を開催しました,https://www.pref.saga.lg.jp/kiji003116022/index.html,佐賀県県土整備部建設・技術課盛土担当,source_has_department_only,問い合わせ先 佐賀県県土整備部建設・技術課盛土担当 電話:0952-25-7180 FAX:0952-25-7317 Eメール:kensetsu-gijutsu@pref.saga.jp ©2025 Saga Prefecture.
2283,press_release,2025-12-23,「世界の文化創造拠点ARITAプロジェクト」における自走化戦略策定及びプロジェクトチーム運営業務の委託先を決定しました,https://www.pref.saga.lg.jp/kiji003118192/index.html,観光課,no_contact_section_detected,「世界の文化創造拠点ARITAプロジェクト」における自走化戦略策定及びプロジェクトチーム運営業務の委託先を決定しました / 最終更新日: / 2025年12月23日 / 「世界の文化創造拠点ARITAプロジェクト」における自走化戦略策定及びプロジェクトチーム運営業務の委託先を決定しました / 「世界の文化創造拠点ARITAプロジェクト」における自走化戦略策定及びプロジェクトチーム運営業務委託を行うにあたり、企画提案競技(プロポーザル方式)にて委託候補者を選出し、下記のとおり契
2041,proposal,2025-12-23,佐賀酒国際コンペティション出品支援事業費補助金の募集を行います,https://www.pref.saga.lg.jp/kiji003117445/index.html,佐賀県 産業労働部 流通・貿易課 国際経済担当,needs_reingest_inline_person,〒840-8570 佐賀市城内1-1-59 佐賀県 産業労働部 流通・貿易課 国際経済担当 TEL:0952-25-7146(直通) E-mail:globalsupport@pref.saga.lg.jp ※受付時間8時30分~17時15分(土曜日・日曜日・祝日を除く。)
2715,press_release,2025-12-22,【開催しました】令和7年度経営者向けセミナーを開催します,https://www.pref.saga.lg.jp/kiji00399613/index.html,建設・技術課,no_contact_section_detected,【開催しました】令和7年度経営者向けセミナーを開催します / 最終更新日: / 2025年12月22日 / 【開催しました】 / 令和7年度経営者向けセミナーを開催します / 佐賀県では、県内建設業の経営基盤強化や担い手育成等を支援するため、「建設業基盤強化事業」に取り組んでいます。 / この事業の一環として、以下のとおり各種セミナーを開催しますのでお知らせします。 / ◇ 参加費は
183,proposal,2025-12-22,SAGA BARプロモーション事業「若者向け佐賀酒学」業務委託に係る企画提案競技(プロポーザル)を実施いたします,https://www.pref.saga.lg.jp/kiji003117429/index.html,流通・貿易課,no_contact_section_detected,SAGA BARプロモーション事業「若者向け佐賀酒学」業務委託に係る企画提案競技(プロポーザル)を実施いたします / 最終更新日: / 2025年12月22日 / SAGABARプロモーション事業「若者向け佐賀酒学」業務委託に係る企画提案競技(プロポーザル)を実施いたします / 下記のとおり、企画提案競技(プロポーザル)を実施します。 / 1 委託業務名 / SAGABARプロモーション事業「若者向け佐賀酒学」 / 2 業務の目的
185,proposal,2025-12-19,唐津青翔高等学校eスポーツ学科の教材制作等業務委託に係るプロポーザルの結果をお知らせします,https://www.pref.saga.lg.jp/kiji003117316/index.html,教育振興課,result_or_answer_page_without_contact,唐津青翔高等学校eスポーツ学科の教材制作等業務委託に係るプロポーザルの結果をお知らせします
