project_id,source_type,published_at,title,url,raw_department_name,cause_bucket,evidence
2092,proposal,2025-10-01,第1回スポチャレカップ2025 10月1日(水曜日)エントリー募集開始,https://www.pref.saga.lg.jp/kids/kiji003115975/index.html,保健体育課,no_contact_section_detected,第1回スポチャレカップ2025 10月1日(水曜日)エントリー募集開始 / 最終更新日: / 2025年10月1日 / 2025年10月1日(水曜日)~31日(金曜日)かいさい 佐賀県内すべての小学生のチャレンジをぼしゅう / 「やってみよう!」 / 秋の過ごしやすい季節がやってきました。運動会の前にクラスのみんなでもう一度50mの記録をはかり、 / 1学期よりも成長した実感を味わってはどうですか? / 大会概要
220,press_release,2025-09-30,第63回技能5輪全国大会・第45回全国アビリンピックの入賞者が入賞報告を行われます,https://www.pref.saga.lg.jp/kiji00378360/index.html,産業人材課 スキルアップ担当,needs_reingest_inline_person,【技能5輪に関すること】 産業人材課 スキルアップ担当 担 当 者 垣永・虎取 内線 2187 直通 952-25-7310 E-mail:sangyoujinzai@pref.saga.lg.jp
2647,press_release,2025-09-29,種畜証明書の書換交付(千代萬徳),https://www.pref.saga.lg.jp/kiji003116037/index.html,畜産課,no_contact_section_detected,種畜証明書の書換交付(千代萬徳) / 最終更新日: / 2025年9月29日 / 公 示 / 家畜改良増殖法(昭和25年法律第209号)第8条第1項の規定に基づき、次のとおり種畜証明書の書換交付に伴い農林水産大臣から通報があったので、同法第8条第2項の規定に基づき公示する。 / (肉用牛) / 証明書番号 / 申請の事由
1341,proposal,2025-09-29,令和4年9月県有地一般競争入札の結果について,https://www.pref.saga.lg.jp/kiji00388627/index.html,九州電力送配電株式会社佐賀配電事業所 設備建設グループ,needs_reingest_inline_person,(PDF:627.7キロバイト) 問い合わせ先:総務部 資産活用課 TEL:0952-25-7197 メール: shisankatsuyou@pref.saga.lg.jp
2335,press_release,2025-09-25,「人権ワークショップ」を実施しました。(3日月小),https://www.pref.saga.lg.jp/kiji003115837/index.html,人権・同和対策課,no_contact_section_detected,「人権ワークショップ」を実施しました。(3日月小) / 最終更新日: / 2025年9月25日 / 令和7年9月10日(水曜日)に、3日月小学校で「人権ワークショップ」を実施しました。 / 〇参加者 3年生 3クラス(115名) / 〇ワークショップの様子 / 教室に入っていくと、子どもたちは笑顔で私たちを迎えてくれました。動画視聴後の、グループワーク時の「自分だったらどうするかな。」「どんな 気持ちになるかな。」と一生懸命考えている様子や発表する姿が印象的でした。 / (参
2843,press_release,2025-09-24,スポチャレカップ2025開催のお知らせ,https://www.pref.saga.lg.jp/kids/kiji003115935/index.html,保健体育課,no_contact_section_detected,スポチャレカップ2025開催のお知らせ / 最終更新日: / 2025年9月24日 / 「スポチャレカップ2025」開催のお知らせ / スポーツの秋、スポチャレの秋ということで、今年度も「スポチャレカップ2025」を開催します。 / 「スポチャレカップ」とは? / 期間と種目を限定してスポーツチャレンジに取り組む機会をつくることで、これまであまり取り組んでいなかった学校や学級での取組を促進するために2024年度から開催しています。各回において、各学年のトップだった学級に「スポ
194,proposal,2025-09-24,唐津キャッスルベイ拠点エリア(西ノ浜地区)基本計画策定等業務委託(プロポーザル方式)の契約結果について,https://www.pref.saga.lg.jp/kiji003114715/index.html,港湾課,no_contact_section_detected,唐津キャッスルベイ拠点エリア(西ノ浜地区)基本計画策定等業務委託(プロポーザル方式)の契約結果について / 最終更新日: / 2025年9月24日 / 唐津キャッスルベイ拠点エリア(西ノ浜地区)基本計画策定等業務委託について審査の結果、以下のとおり契約しました。 / 1 業務名 / 唐津キャッスルベイ拠点エリア(西ノ浜地区)基本計画策定等業務委託 / 2 契約者 / 株式会社オープン・エー
1349,proposal,2025-09-19,「人材確保プロジェクト推進事業」企画運営業務委託に係るプロポーザルの審査結果について,https://www.pref.saga.lg.jp/kiji003116511/index.html,さが 創生推進課,result_or_answer_page_without_contact,「人材確保プロジェクト推進事業」企画運営業務委託に係るプロポーザルの審査結果について
2351,press_release,2025-09-17,地域脱炭素移行・再エネ推進交付金(重点対策加速化事業),https://www.pref.saga.lg.jp/kiji003115809/index.html,脱炭素社会推進課,no_contact_section_detected,地域脱炭素移行・再エネ推進交付金(重点対策加速化事業) / 最終更新日: / 2025年9月17日 / 地域脱炭素移行・再エネ推進交付金(重点対策加速化事業) / 佐賀県では、2030年度における県内の温室効果ガス排出量を2013年度比で47%削減をするとともに、2050年カーボンニュートラルを見据えて、様々な取組を着実に進めているところです。 / この度、環境省の令和7年度「地域脱炭素移行・再エネ推進交付金(重点対策加速化事業)」において、「SAGAゼロカーボン加速化事業」
2016,proposal,2025-09-17,令和7年度佐賀県服薬対策事業データ分析事業業務委託の委託先が決定しました。,https://www.pref.saga.lg.jp/kiji003115201/index.html,国民健康保険課,no_contact_section_detected,令和7年度佐賀県服薬対策事業データ分析事業業務委託の委託先が決定しました。 / 最終更新日: / 2025年9月17日 / 令和7年度佐賀県服薬対策事業データ分析事業業務委託の委託先が決定しました。 / 令和7年度佐賀県服薬対策事業データ分析事業業務委託に係るプロポーザルを実施した結果、下記のとおり契約を締結したのでお知らせします。 / 1 委託業務名 / 令和7年度佐賀県服薬対策事業データ分析事業業務委託 / 2 契約の相手方
2598,press_release,2025-09-12,令和7年度佐賀県愛鳥週間ポスターコンクールの入賞者が決定しました,https://www.pref.saga.lg.jp/kiji00398815/index.html,生産者支援課,no_contact_section_detected,令和7年度佐賀県愛鳥週間ポスターコンクールの入賞者が決定しました / 最終更新日: / 2025年9月12日 / 令和7年度「佐賀県愛鳥週間ポスターコンクール」の入賞者が決定しました / 佐賀県では、ポスター制作を通じて児童・生徒の自然や野生鳥類を愛する心を育むため、毎年度「佐賀県愛鳥週間ポスターコンクール」を実施しています。 / 今年度も、県内の小学校、中学校及び高等学校を通じて作品を募集したところ、41校から296点の応募があり、審査の結果、別添のとおり入賞者を決定しまし
1793,press_release,2025-09-12,佐賀県の情報公開・個人情報保護制度,https://www.pref.saga.lg.jp/kiji00327884/index.html,法務私学課,no_contact_section_detected,佐賀県の情報公開・個人情報保護制度 / 最終更新日: / 2025年9月12日 / 情報公開(公文書開示)制度 / 公文書公開制度とは、佐賀県情報公開条例に基づき、みなさんからの請求に対して、条例上の不開示情報に該当しない限り、県が保有する公文書をそのままの形で公開する制度です。 / 公文書開示制度の概要 / 公文書開示制度の概要、公文書の開示請求の手続き / 情報公開制度の運用状況
2844,press_release,2025-09-11,R7スポチャレ途中ランキング公開!!,https://www.pref.saga.lg.jp/kids/kiji003115734/index.html,保健体育課,no_contact_section_detected,R7スポチャレ途中ランキング公開!! / 最終更新日: / 2025年9月11日 / 夏休み前までのR7スポーツチャレンジの暫定ランキングです。 / さあ、目標の記録を設定して学級で、学校全体でチャレンジしてみましょう! / 【R7.8.25現在】8の字とび(1年生) / (PDF:72.6キロバイト) / 【R7.8.25現在】8の字とび(3年生)
2807,press_release,2025-09-08,大学生教職体験プログラム広報業務の委託先を決定しました。,https://www.pref.saga.lg.jp/kiji003115730/index.html,教職員課,no_contact_section_detected,大学生教職体験プログラム広報業務の委託先を決定しました。 / 最終更新日: / 2025年9月8日 / 大学生教職体験プログラム広報業務の委託契約を行うにあたり、令和7年7月18日(金曜日)にプロポーザル審査会を実施したところ、下記の結果となりました。 / 記 / 1 契約案件名 / 大学生教職体験プログラム広報委託業務 / 2 契約の相手方
2634,press_release,2025-09-08,「佐賀県水田収益力強化ビジョン」を公表します,https://www.pref.saga.lg.jp/kiji00398446/index.html,園芸農産課,no_contact_section_detected,「佐賀県水田収益力強化ビジョン」を公表します / 最終更新日: / 2025年9月8日 / 県は、高収益作物の導入などによる収益力強化や、畑地化を含む水田の有効利用を含め、産地としての課題と対応方向等を明確化した「水田収益力強化ビジョン」を、別添のとおり作成しましたので公表いたします。 / この「水田収益力強化ビジョン」は、水田における作物ごとの取組方針・作付予定面積を明らかにし、県全体で共有することで、水田農業を維持・発展させていく取組を更に推進することを目的としています。
58,proposal,2025-09-05,【質問回答】令和7年度佐賀県医療費等分析事業業務委託に係るプロポーザルの質問への回答を掲載します,https://www.pref.saga.lg.jp/kiji003115708/index.html,国民健康保険課,result_or_answer_page_without_contact,【質問回答】令和7年度佐賀県医療費等分析事業業務委託に係るプロポーザルの質問への回答を掲載します
2183,press_release,2025-09-03,令和7年度9月補正予算についてお知らせします,https://www.pref.saga.lg.jp/kiji003115653/index.html,財政課,no_contact_section_detected,令和7年度9月補正予算についてお知らせします / 最終更新日: / 2025年9月3日 / 今回の予算編成については、6月追加補正予算編成後の情勢の推移に対応するため、早急に措置を要するものについて所要額を計上しました。 / 添付資料 / 令和7年度9月補正予算の概要 / (PDF:2.37メガバイト) / 令和7年度9月補正予算主要事項(第3号)
2251,press_release,2025-09-01,唐津線・筑肥線の新規通学定期券半額補助キャンペーンのお知らせ,https://www.pref.saga.lg.jp/kiji003114634/index.html,鉄道活用推進担当,source_has_department_only,3 お問い合わせ先 佐賀県 交通政策課(鉄道活用推進担当) 午前8時30分から午後5時15分まで(土日祝日・年末年始を除く) 電話:0952-25-7341 メール:koutsuuseisaku@pref.saga.lg.jp (メールでのお問い合わせの際は、件名に「通学定期券半額キャンペーン」と明記してください。)
1961,proposal,2025-09-01,令和7年度「歩こう。佐賀県。」情報発信等業務委託契約を締結しました,https://www.pref.saga.lg.jp/kiji003116602/index.html,交通政策課,no_contact_section_detected,令和7年度「歩こう。佐賀県。」情報発信等業務委託契約を締結しました / 最終更新日: / 2025年9月1日 / 令和7年度「歩こう。佐賀県。」情報発信等業務委託契約を締結しました / 令和7年度「歩こう。佐賀県。」情報発信等業務委託について、プロポーザル方式により、下記のとおり契約を締結しました。 / 1 委託業務名 / 令和7年度「歩こう。佐賀県。」情報発信等業務 / 2 契約の相手方
2658,press_release,2025-08-29,令和6年度実施状況,https://www.pref.saga.lg.jp/kiji00369062/index.html,農山村課,no_contact_section_detected,"令和6年度実施状況 / 最終更新日: / 2025年8月29日 / 令和6年度実施状況 / 令和6年度は19市町の約6,608ヘクタールの農用地において、465協定が耕作放棄地の発生防止活動、水路・農道等の管理及び多面的機能を増進する活動などの農業生産活動を継続するための活動に取り組んでいます。うち417協定では、これらの活動に加え体制整備のための前向きな活動として、協定参加者が地域の6~10年後の将来や農地をどのように引き継ぎ守っていくかを話し合い、集落戦略の作成に取り組ん"
2636,press_release,2025-08-29,産地生産基盤パワーアップ事業のうち国産シェア拡大対策(麦・大豆)交付対象事業の概要を公表します,https://www.pref.saga.lg.jp/kiji003108587/index.html,園芸農産課,no_contact_section_detected,産地生産基盤パワーアップ事業のうち国産シェア拡大対策(麦・大豆)交付対象事業の概要を公表します / 最終更新日: / 2025年8月29日 / 産地生産基盤パワーアップ事業のうち国産シェア拡大対策(麦・大豆)は、国産麦・大豆の安定供給体制を構築するため、農業機械や乾燥調製施設の導入、調整保管機能を有するストックセンターの整備、国産麦・大豆の利用拡大に向けた処理加工施設の整備等を支援するものです。 / 佐賀県における取組概要については、別添ファイルのとおりです。 / 令和6年度
2486,press_release,2025-08-29,第47回佐賀県男女共同参画推進審議会を開催します,https://www.pref.saga.lg.jp/kiji003115565/index.html,健康福祉部男女参画・女性の活躍推進課,source_has_department_only,問い合わせ先 担当課 健康福祉部男女参画・女性の活躍推進課 電話 0952-25-7062(直通) FAX 0952-25-7338 E-mail:danjo-katsuyaku@pref.saga.lg.jp ---
2239,press_release,2025-08-28,【九州佐賀国際空港パスポート取得キャンペーン】が実施されています,https://www.pref.saga.lg.jp/kiji003115599/index.html,多文化共生さが推進課,no_contact_section_detected,【九州佐賀国際空港パスポート取得キャンペーン】が実施されています / 最終更新日: / 2025年8月28日 / 【九州佐賀国際空港パスポート取得キャンペーン】が実施されています / 九州佐賀国際空港の上海便・台北便の増便を記念して、パスポートを取得し上海便・台北便を利用される佐賀県民にパスポートの取得費用を助成するキャンペーンが実施されています。 / 詳しくは / こちらのリンク / をご確認ください。
1932,proposal,2025-08-28,佐賀県職員(物理)を募集します【通年募集】,https://www.pref.saga.lg.jp/kiji003115113/index.html,佐賀県総務部人事課人事担当,source_has_department_only,9 問い合わせ先 不明な点があれば、下記までお問い合わせください。 佐賀県総務部人事課人事担当 電話 0952-25-7011(直通) E-mail:jinji-ml@pref.saga.lg.jp この選考試験の実施に伴いご提出いただいた個人情報は、採用選考のためのみに使 用し、それ以外の目的のために使用することはありません。
2622,press_release,2025-08-27,令和7年度秋の農作業安全運動を開始します!,https://www.pref.saga.lg.jp/kiji003115507/index.html,農業経営課,no_contact_section_detected,令和7年度秋の農作業安全運動を開始します! / 最終更新日: / 2025年8月27日 / 「令和7年度秋の農作業安全運動」実施中! / 令和7年9月1日~10月31日まで、令和7年度秋の農作業安全運動を実施しています。 / 農繁期中の事故に備え、安全な作業を心がけましょう。 / トラクター / 〇道路の路肩や、ほ場の出入口、傾斜地での走行に10分注意し、転倒、転落時の安全のため作業中は必ずシートベルトとヘルメットを着用しましょう。
2599,press_release,2025-08-26,令和7年度狩猟免許更新講習及び適性検査のお知らせ,https://www.pref.saga.lg.jp/kiji00360437/index.html,佐賀県農林水産部生産者支援課 鳥獣対策担当,needs_reingest_inline_person,佐賀市城内1丁目1番59号 佐賀県農林水産部生産者支援課 鳥獣対策担当 電話:0952-25-7113 【個人情報の取扱いについて】 狩猟免許更新申請において提出された個人情報は、狩猟免許更新申請の審査、狩猟免許の所持者に対する指導監督等の目的にのみ使用し、それ以外の目的においては使用いたしません。
2487,press_release,2025-08-19,佐賀県立男女共同参画センター及び佐賀県立生涯学習センター管理者の事業報告を公表します,https://www.pref.saga.lg.jp/kiji003115473/index.html,男女参画・女性の活躍推進課,no_contact_section_detected,佐賀県立男女共同参画センター及び佐賀県立生涯学習センター管理者の事業報告を公表します / 最終更新日: / 2025年8月19日 / 佐賀県立男女共同参画センター及び佐賀県立生涯学習センターの管理運営に関する協定書の事業報告を公表します。 / 指定管理者:公益財団法人佐賀県女性と生涯学習財団 / 指定期間:令和5年4月1日~令和11年3月31日 / 対象年度:令和6年度 / 報告書:
143,proposal,2025-08-15,【質問回答書】「佐賀県総務事務(年末調整及び認定事務関連業務)に係る労働者派遣業務」の条件付一般競争入札,https://www.pref.saga.lg.jp/kiji003115422/index.html,佐賀県出納局総務事務センター 給与・報酬担当,source_has_department_only,お問い合わせ先 佐賀県出納局総務事務センター 給与・報酬担当 電話 0952-25-7089 FAX 0952-25-7523 E-mail soumujimu@pref.saga.lg.jp
144,proposal,2025-08-14,「山の博覧会」(仮称)コンセプト等の作成支援業務委託に係るプロポーザルの結果をお知らせします,https://www.pref.saga.lg.jp/kiji003113360/index.html,さが 創生推進課,result_or_answer_page_without_contact,「山の博覧会」(仮称)コンセプト等の作成支援業務委託に係るプロポーザルの結果をお知らせします
2139,press_release,2025-08-13,8月10日からの大雨による被害状況等をお知らせします(8月13日13時0分現在),https://www.pref.saga.lg.jp/bousai/kiji003115324/index.html,報道課,no_contact_section_detected,8月10日からの大雨による被害状況等をお知らせします(8月13日13時0分現在) / 最終更新日: / 2025年8月13日 / 8月10日からの大雨による被害状況等をお知らせします(8月13日13時0分現在) / 8月10日からの大雨による被害状況等について、下記のとおり新たに被害を覚知したのでお知らせします。 / 記 / 1 人的被害 / 人的被害の報告はありません
2284,press_release,2025-08-08,「令和7年度グランブルー・ツーリズム広報戦略策定及び情報発信事業」の委託先を決定しました,https://www.pref.saga.lg.jp/kiji003115206/index.html,観光課,no_contact_section_detected,「令和7年度グランブルー・ツーリズム広報戦略策定及び情報発信事業」の委託先を決定しました / 最終更新日: / 2025年8月8日 / 「令和7年度グランブルー・ツーリズム広報戦略策定及び情報発信事業」の委託先を決定しました / 令和7年度グランブルー・ツーリズム広報戦略策定及び情報発信事業業務委託を行うにあたり、企画提案競技(プロポーザル方式)にて委託候補者を選出し、下記の通り契約を締結しましたのでお知らせいたします。 / 記 / 1.委託事業名 / 令和7年度グランブルー
2145,press_release,2025-08-08,山と緑の価値を未来につなぐ 山の博覧会(仮称)・全国都市緑化フェア令和10年開催決定,https://www.pref.saga.lg.jp/chiji/kiji003115169/index.html,報道課,no_contact_section_detected,山と緑の価値を未来につなぐ 山の博覧会(仮称)・全国都市緑化フェア令和10年開催決定 / 最終更新日: / 2025年8月8日 / 2つ目です。「山と緑の価値を未来につなぐ」ということで、山博と全国都市緑化フェアを令和10年に開催決定というお話を改めてさせていただきます。 / 山、特に佐賀県は山から川から海からがコンパクトにまとまった県ということでありまして、特に私は下流域のみんなが源流に対する敬意を持ちながらやっていくべきではないのかなというふうにずっと思っておりまして、例
751,proposal,2025-08-08,【質問への回答】令和7年度男女共同参画社会づくりのための県民意識調査業務委託に係る公募型プロポーザルに関する質問について,https://www.pref.saga.lg.jp/kiji003115166/index.html,男女参画・女性の活躍推進課,result_or_answer_page_without_contact,【質問への回答】令和7年度男女共同参画社会づくりのための県民意識調査業務委託に係る公募型プロポーザルに関する質問について
39,proposal,2025-08-07,DXスキル向上につながる学びを支える土台・人づくりに係る業務委託の企画提案競技(企画コンペ方式)の審査結果をお知らせします,https://www.pref.saga.lg.jp/kiji003115498/index.html,行政デジタル推進課,result_or_answer_page_without_contact,DXスキル向上につながる学びを支える土台・人づくりに係る業務委託の企画提案競技(企画コンペ方式)の審査結果をお知らせします
2810,press_release,2025-08-01,佐賀県公立学校特定事業主行動計画の取組の実施状況の公表について,https://www.pref.saga.lg.jp/kyouiku/kiji003114402/index.html,教職員課,no_contact_section_detected,佐賀県公立学校特定事業主行動計画の取組の実施状況の公表について / 最終更新日: / 2025年8月1日 / 佐賀県公立学校特定事業主行動計画の取組の実施状況の公表について(令和7年7月) / 佐賀県公立学校では、女性の職業生活における活躍の推進に関する法律(平成27年法律第64号。以下「女性活躍推進法」という。)及び次世代育成支援対策推進法(平成15年法律第120号)に基づき、「佐賀県公立学校特定事業主行動計画」を策定し取組を推進しています。 / 今般、女性活躍推進法第19
2489,press_release,2025-08-01,令和7年度マイナス1歳からのイクカジ推進事業業務の委託先を決定しました,https://www.pref.saga.lg.jp/kiji003115104/index.html,男女参画・女性の活躍推進課,no_contact_section_detected,令和7年度マイナス1歳からのイクカジ推進事業業務の委託先を決定しました / 最終更新日: / 2025年8月1日 / 令和7年度マイナス1歳からのイクカジ推進事業に係るプロポーザル審査会の結果、下記のとおり委託先が決定しました。 / 1.委託業務名 / 令和7年度マイナス1歳からのイクカジ推進事業業務委託 / 2.委託先 / 特定非営利活動法人ファザーリング・ジャパン九州
2637,press_release,2025-07-31,令和6年度強い農業づくり総合支援交付金交付対象事業の概要を公表します,https://www.pref.saga.lg.jp/kiji003115845/index.html,園芸農産課,no_contact_section_detected,令和6年度強い農業づくり総合支援交付金交付対象事業の概要を公表します / 最終更新日: / 2025年7月31日 / 強い農業づくり総合支援交付金は、国の支援事業であり、生産・経営から流通までの総合的な強い農業づくりを支援するため、農畜産物の高品質・高付加価値化、低コスト化及び食品流通の合理化等、地域における川上から川下までの対策を総合的に推進するものです。 / 佐賀県における令和6年度の取組概要については、別添ファイルのとおりです。 / 令和6年度強い農業づくり総合支援交付
2748,press_release,2025-07-30,浄化槽に関する各種届出・報告について,https://www.pref.saga.lg.jp/kiji00373997/index.html,佐賀中部保健福祉事務所,source_has_department_only,届出先・お問い合わせ先 事務所名称 住所 電話番号・FAX番号 管轄地域 佐賀中部保健福祉事務所
